{
  "schema_version": "1.0",
  "id": "denmark",
  "name": "Denmark (Danmark)",
  "jurisdiction_code": "DK",
  "legal_system": "civil-law",
  "language": ["da"],
  "license": "CC-BY-4.0",
  "generated": "2026-06-04",
  "summary": "Denmark is a Nordic civil-law unitary kingdom whose family-court framework was substantially restructured by the 2019 Familieretshuset reform (Lov om Familieretshuset 2018) which created a single-entry administrative-and-judicial pathway for family disputes. The Forældreansvarsloven 2007 (Parental Responsibility Act) governs joint parental responsibility (forældremyndighed), residence (bopæl) and contact (samvær); joint custody is the statutory default. Family-law cases proceed through Familieretshuset administrative determination, then the Familieretten (specialist family court) at District Court level, the Landsret (High Court of Appeal), and the Højesteret (Supreme Court of Denmark, Copenhagen). Psychology profession is regulated under the Psykologloven (Psychology Act) of 1993 with autorisasjon issued by Psykolognævnet under the Ministry of Social Affairs. Denmark is silent on 'parental alienation' as a statutory label; courts operate substantively under the barnets bedste (best-interests-of-the-child) welfare standard.",
  "pa_recognition_status": {
    "statutory": "silent",
    "apex_court_position": "no-apex-position",
    "professional_regulator_position": "silent"
  },
  "statutory_framework": [
    {
      "citation": "Forældreansvarsloven 2007",
      "title": "Parental Responsibility Act 2007",
      "year": 2007,
      "url": "https://www.retsinformation.dk/eli/lta/2007/499",
      "relevance": "Federal statute consolidating parental responsibility, residence and contact. § 4 establishes joint parental responsibility as the default. § 17 governs decisions on residence; § 19-21 govern contact. § 4 also codifies the barnets bedste welfare standard as decisive."
    },
    {
      "citation": "Lov om Familieretshuset 2018",
      "title": "Family Court Administration Act 2018",
      "year": 2018,
      "url": "https://www.retsinformation.dk/eli/lta/2018/1702",
      "relevance": "Established Familieretshuset (the Family Court Administration) and the Familieretten specialist family court at District Court level. In force 1 April 2019. Substantial restructuring of the family-law pathway with administrative-first determination by Familieretshuset and judicial review by Familieretten for contested matters."
    },
    {
      "citation": "Psykologloven 1993",
      "title": "Psychology Act 1993",
      "year": 1993,
      "url": "https://www.retsinformation.dk/eli/lta/1993/494",
      "relevance": "Federal statute regulating the psychology profession. Statutorily protected title 'psykolog' requires autorisasjon issued by Psykolognævnet under the Ministry of Social Affairs. Statutory anchor for evaluator-quality."
    }
  ],
  "apex_courts": [
    {
      "name": "Højesteret (Supreme Court of Denmark)",
      "seat": "København (Copenhagen)",
      "url": "https://www.hoejesteret.dk/",
      "role": "Apex court for civil and criminal matters. Family-law decisions reach Højesteret via the Landsret (High Court of Appeal) following Familieretten (specialist family court at District Court level) determinations following Familieretshuset administrative-first determination."
    }
  ],
  "professional_regulators": [
    {
      "name": "Psykolognævnet (Psychology Board)",
      "url": "https://www.psykolognaevnet.dk/",
      "role": "Statutory regulatory board for psychologists under Psykologloven 1993. Issues autorisasjon and operates disciplinary jurisdiction under the Ministry of Social Affairs."
    },
    {
      "name": "Dansk Psykolog Forening (Danish Psychological Association)",
      "url": "https://www.dp.dk/",
      "role": "Peak professional association for psychologists in Denmark. Operates ethics code and complaints procedure alongside the statutory Psykolognævnet regime."
    }
  ],
  "anonymisation_convention": "Danish family-law decisions are anonymised per Højesteret and Landsret practice using initials. Published decisions on Domstol.dk and Retsinformation strip identifying details.",
  "key_developments": [
    {
      "year": 1993,
      "title": "Psykologloven 1993",
      "description": "Psychology Act 1993 enacted; statutorily protected title 'psykolog' with autorisasjon under Ministry of Social Affairs."
    },
    {
      "year": 2007,
      "title": "Forældreansvarsloven 2007",
      "description": "Parental Responsibility Act consolidated joint-custody-default and welfare-standard framework."
    },
    {
      "year": 2019,
      "title": "Familieretshuset reform in force",
      "description": "Lov om Familieretshuset 2018 in force 1 April 2019 — single-entry administrative-and-judicial pathway for family disputes through Familieretshuset (administrative) and Familieretten (judicial)."
    }
  ],
  "structural_findings": [
    "Denmark sits structurally within the Nordic civil-law cluster alongside Sweden + Norway + Finland + Iceland — Forældreansvarsloven 2007 joint-custody default + Familieretshuset 2019 administrative-first pathway + Psykologloven 1993 autorisasjon.",
    "Familieretshuset reform creates a structurally distinctive single-entry administrative pathway that processes the majority of family disputes administratively, with judicial review only for contested matters. Distinctive among corpus jurisdictions for the prominent administrative-first family-law architecture.",
    "Psykolognævnet statutory-autorisasjon regime places Denmark among the federal-statutory psychology regulator group within the corpus alongside HCPC UK + HPCSA SA + APBs IN + PsyG CH + PG 2013 AT + CORU IE + Socialstyrelsen SE + Psychologists Law 1977 IL + OPP PT + Helsedirektoratet NO."
  ],
  "references": [
    "jurisdiction:sweden",
    "jurisdiction:norway",
    "jurisdiction:european-convention-on-human-rights",
    "evidence:evaluator-quality-regulation-across-jurisdictions",
    "evidence:childrens-rights-paramountcy-doctrine"
  ],
  "sources": [
    {
      "title": "Højesteret (Supreme Court of Denmark)",
      "url": "https://www.hoejesteret.dk/",
      "publisher": "Domstolsstyrelsen",
      "language": "da,en"
    },
    {
      "title": "Retsinformation — Danish legal information",
      "url": "https://www.retsinformation.dk/",
      "publisher": "Civilstyrelsen",
      "language": "da"
    },
    {
      "title": "Psykolognævnet",
      "url": "https://www.psykolognaevnet.dk/",
      "publisher": "Psykolognævnet",
      "language": "da"
    },
    {
      "title": "Dansk Psykolog Forening",
      "url": "https://www.dp.dk/",
      "publisher": "Dansk Psykolog Forening",
      "language": "da"
    }
  ],
  "editorial_notes": [
    "Denmark jurisdiction sidecar — Nordic civil-law framework. Forældreansvarsloven 2007 + Familieretshuset 2019 + Psykologloven 1993.",
    "PA-recognition: silent statutory + no-apex-position + silent regulator.",
    "Joins Nordic + federal-statutory psychology regulator + administrative-first-pathway distinctive clusters."
  ]
}
