{
  "schema_version": "1.0",
  "id": "uzbekistan",
  "name": "Uzbekistan (Republic of Uzbekistan / O'zbekiston Respublikasi)",
  "jurisdiction_code": "UZ",
  "legal_system": "civil-law",
  "language": ["uz"],
  "license": "CC-BY-4.0",
  "generated": "2026-06-04",
  "summary": "Uzbekistan is a Central Asian civil-law unitary republic whose family-law framework operates under the Family Code 1998 (Oilaviy Kodeks, substantially amended) — federal civil-code framework drawing on post-Soviet civil-law tradition. Parental rights and child custody are governed by Family Code arts. 65-87. The Supreme Court of Uzbekistan (O'zbekiston Respublikasi Oliy sudi) is the apex court for civil and criminal matters; the Constitutional Court (Konstitutsiyaviy sud) operates separate constitutional review. Family-law matters are heard at first instance in District/City Inter-District Civil Courts. Psychology profession is regulated through the Ministry of Health framework. Uzbekistan is silent on 'parental alienation' as a statutory label; courts operate substantively under the child's-interests standard codified in Family Code art. 65. Uzbekistan acceded to the Hague Convention 1980 effective 1 August 2000.",
  "pa_recognition_status": {
    "statutory": "silent",
    "apex_court_position": "no-apex-position",
    "professional_regulator_position": "silent"
  },
  "statutory_framework": [
    {
      "citation": "Family Code 1998 arts. 65-87",
      "title": "Family Code — Parental rights and custody",
      "year": 1998,
      "url": "https://www.lex.uz/",
      "relevance": "Federal Family Code enacted post-Soviet. Arts. 65-87 govern parental rights and child custody. Substantially amended over subsequent decades."
    },
    {
      "citation": "Law on the Rights of the Child 2008",
      "title": "Law on the Rights of the Child",
      "year": 2008,
      "url": "https://www.lex.uz/",
      "relevance": "Federal children's rights statute aligned with UNCRC obligations."
    }
  ],
  "apex_courts": [
    {
      "name": "Supreme Court (Oliy sud)",
      "seat": "Tashkent",
      "url": "https://www.sud.uz/",
      "role": "Apex court for civil and criminal matters."
    },
    {
      "name": "Constitutional Court (Konstitutsiyaviy sud)",
      "seat": "Tashkent",
      "url": "https://www.ksu.uz/",
      "role": "Constitutional Court with original jurisdiction over constitutional review."
    }
  ],
  "professional_regulators": [
    {
      "name": "Ministry of Health, Uzbekistan",
      "url": "https://www.minzdrav.uz/",
      "role": "Federal regulator of health and allied health professionals including clinical psychology."
    }
  ],
  "anonymisation_convention": "Uzbek family-court decisions are anonymised per Supreme Court practice using initials.",
  "key_developments": [
    {
      "year": 1998,
      "title": "Family Code 1998",
      "description": "Federal Family Code enacted post-Soviet codifying marriage, parental rights and child custody."
    },
    {
      "year": 2000,
      "title": "Hague Convention 1980 accession",
      "description": "Uzbekistan acceded to the Hague Convention 1980 effective 1 August 2000 — earliest Central Asian accession in the corpus."
    },
    {
      "year": 2008,
      "title": "Law on the Rights of the Child",
      "description": "Federal children's rights statute enacted aligned with UNCRC obligations."
    }
  ],
  "structural_findings": [
    "Uzbekistan operates a post-Soviet civil-law framework — Family Code 1998 reflects post-Soviet codification trajectory shared with Kazakhstan, Russia, Belarus, Ukraine within the corpus.",
    "Hague Convention 1980 accession 2000 places Uzbekistan as the earliest Central Asian Hague accession within the corpus — structurally distinctive early-mover.",
    "Civil-law framework without explicit Islamic-law personal-status jurisdiction distinguishes Uzbekistan from MENA religious-law cluster despite Muslim-majority demography."
  ],
  "references": [
    "jurisdiction:kazakhstan",
    "jurisdiction:russia",
    "jurisdiction:tajikistan",
    "evidence:cross-border-parental-abduction-and-pa-intersection",
    "evidence:childrens-rights-paramountcy-doctrine"
  ],
  "sources": [
    {
      "title": "Supreme Court of Uzbekistan",
      "url": "https://www.sud.uz/",
      "publisher": "Supreme Court",
      "language": "uz,ru"
    },
    {
      "title": "Constitutional Court",
      "url": "https://www.ksu.uz/",
      "publisher": "Constitutional Court",
      "language": "uz,ru"
    },
    {
      "title": "Legal Information System (Lex.uz)",
      "url": "https://www.lex.uz/",
      "publisher": "Ministry of Justice",
      "language": "uz,ru"
    }
  ],
  "editorial_notes": [
    "Uzbekistan jurisdiction sidecar — civil-law post-Soviet Central Asia. Family Code 1998 + Law on Rights of the Child 2008 + Hague Convention 1980 accession 2000 (earliest Central Asian).",
    "PA-recognition: silent statutory + no-apex-position + silent regulator.",
    "Joins Central Asian + civil-law + post-Soviet + early-Hague Convention clusters within the corpus."
  ]
}
