{
  "schema_version": "1.0",
  "id": "anguilla",
  "name": "Anguilla",
  "jurisdiction_code": "AI",
  "legal_system": "common-law",
  "language": ["en"],
  "license": "CC-BY-4.0",
  "generated": "2026-06-04",
  "summary": "Anguilla is a Caribbean common-law British Overseas Territory whose family-law framework operates under the Children Act 2014 (drawing on English Children Act 1989 model), the Matrimonial Proceedings and Property Act, and the Status of Children Act. Parental responsibility and child custody are governed by Children Act 2014 Part II. The Court of Appeal of the Eastern Caribbean Supreme Court (sitting for Anguilla) is the apex domestic appellate court; final appellate jurisdiction was retained with the Judicial Committee of the Privy Council in London. Family-law matters are heard at first instance in the High Court of Justice and Magistrates' Court. Psychology profession is regulated through the Anguilla Ministry of Health framework. Anguilla is silent on 'parental alienation' as a statutory label; courts operate substantively under the welfare-of-the-child principle codified in Children Act 2014 s. 3. Anguilla is a Hague Convention 1980 party via UK territorial extension effective 1 August 1986.",
  "pa_recognition_status": {
    "statutory": "silent",
    "apex_court_position": "no-apex-position",
    "professional_regulator_position": "silent"
  },
  "statutory_framework": [
    {
      "citation": "Children Act 2014",
      "title": "Children Act",
      "year": 2014,
      "url": "https://www.eccourts.org/",
      "relevance": "Federal Children Act drawing on English Children Act 1989 model codifying welfare-of-the-child principle (s. 3), parental responsibility, custody, and children's protection provisions."
    }
  ],
  "apex_courts": [
    {
      "name": "Eastern Caribbean Supreme Court — Court of Appeal (Anguilla)",
      "seat": "The Valley",
      "url": "https://www.eccourts.org/",
      "role": "Apex domestic appellate court for OECS-shared judicial system including Anguilla."
    },
    {
      "name": "Judicial Committee of the Privy Council",
      "seat": "London",
      "url": "https://www.jcpc.uk/",
      "role": "Final appellate court for civil and criminal matters from Anguilla."
    }
  ],
  "professional_regulators": [
    {
      "name": "Anguilla Ministry of Health",
      "url": "https://www.gov.ai/",
      "role": "Federal regulator of health and allied health professionals including clinical psychology."
    }
  ],
  "anonymisation_convention": "Anguillan family-court decisions are anonymised per ECSC practice using initials.",
  "key_developments": [
    {
      "year": 1967,
      "title": "Anguillan revolution + 1967-1971 secession-from-St-Kitts framework",
      "description": "Anguillan revolution 30 May 1967 — Anguilla declared independence from State of St Christopher-Nevis-Anguilla. Substantively distinctive Caribbean secession-from-associated-statehood pattern. Subsequent UK military intervention 1969 (Operation Sheepskin) restored British authority. Substantive Caribbean political-distinctive framework affecting subsequent constitutional-administrative trajectory."
    },
    {
      "year": 1980,
      "title": "Anguilla formal separation from St Kitts-Nevis + BOT consolidation",
      "description": "Anguilla formally separated from State of St Kitts-Nevis-Anguilla 19 December 1980 — becoming separate British Dependent Territory (later British Overseas Territory). Substantively distinctive constitutional-rearrangement framework within Caribbean cluster — only post-independence-secession-reversal-to-BOT-status globally."
    },
    {
      "year": 1982,
      "title": "Anguilla Constitution 1982 + BOT constitutional framework",
      "description": "Anguilla Constitution Order 1982 (amended 1990) establishing internal-self-government framework with Governor representing the Crown and elected House of Assembly. Foundational constitutional anchor for contemporary family-law jurisprudence within UK-derivative common-law framework."
    },
    {
      "year": 1986,
      "title": "Hague Convention 1980 territorial extension",
      "description": "Hague Convention 1980 territorial extension by UK to Anguilla effective 1 August 1986 — establishing Caribbean Hague Convention jurisdiction framework within UK BOT framework."
    },
    {
      "year": 1994,
      "title": "UK ratifies UN Convention on the Rights of the Child + BOT extension",
      "description": "United Kingdom ratified the UNCRC on 16 December 1991 with extension to Anguilla — establishing best-interests-of-the-child substantive doctrine within UK-derivative common-law framework applicable to Anguilla."
    },
    {
      "year": 2001,
      "title": "British Overseas Territories Act 2002 + British citizenship + status framework",
      "description": "British Overseas Territories Act 2002 (effective 26 February 2002) substantively renamed British Dependent Territories to British Overseas Territories. British citizenship extended to Anguillan BOT citizens substantively affecting cross-border-family-law mobility framework. Substantive consolidation of UK-BOT constitutional framework."
    },
    {
      "year": 2010,
      "title": "Anguilla Banking Crisis 2010 + National Commercial Bank failures + reconstruction",
      "description": "Anguilla National Commercial Bank and Caribbean Commercial Bank failures 2010 substantively affected financial-services framework. Subsequent reconstruction trajectory through Eastern Caribbean Central Bank intervention. Substantive economic disruption affecting family-law-implementation including matrimonial-property-distribution."
    },
    {
      "year": 2014,
      "title": "Children Act 2014",
      "description": "Federal Children Act enacted drawing on English Children Act 1989 model codifying welfare-of-the-child principle (s. 3), parental responsibility, custody, and children's protection provisions. Substantively significant statutory-modernisation within Caribbean BOT framework."
    },
    {
      "year": 2017,
      "title": "Hurricane Irma 2017 + reconstruction + Brexit context",
      "description": "Hurricane Irma 6 September 2017 substantively devastated Anguilla — among the most-distinctive Caribbean climate-disaster events. Substantive demographic and family-law-implementation disruption through post-disaster reconstruction trajectory. UK Brexit context 2016-2020 substantively affecting BOT-EU-Member-State trade relationships affecting cross-border-jurisdiction practice."
    },
    {
      "year": 2023,
      "title": "Webster premiership + Anguilla Domestic Violence Act framework + Department of Social Development",
      "description": "Cora Richardson-Hodge (subsequently 2025) and Ellis Webster (APM) premiership 2020-2025 framework consolidation through 2023. Department of Social Development institutional position addressing PA-related issues within Children Act 2014 framework. Anguilla Domestic Violence Act framework substantively significant institutional context. Substantively significant Caribbean BOT institutional jurisprudential development."
    },
    {
      "year": 2024,
      "title": "ECSC + JCPC — welfare-of-the-child substantive register",
      "description": "Eastern Caribbean Supreme Court and Judicial Committee of the Privy Council continue to develop welfare-of-the-child jurisprudence under Children Act 2014 s. 3 + Hague Convention 1980 framework in custody disputes without adopting the 'parental alienation' label as a doctrinal term. Substantive analysis within Caribbean-BOT-common-law + JCPC-final-appellate framework."
    }
  ],
  "structural_findings": [
    "Anguilla operates a common-law framework with British Overseas Territory status — places Anguilla in the Caribbean BOT cluster.",
    "Eastern Caribbean Supreme Court appellate jurisdiction (OECS-shared) places Anguilla alongside BVI in the OECS-shared-judicial-system BOT cluster.",
    "Hague Convention 1980 applicability via UK territorial extension reflects BOT Hague jurisdiction status."
  ],
  "references": [
    "jurisdiction:united-kingdom",
    "jurisdiction:british-virgin-islands",
    "jurisdiction:montserrat",
    "evidence:cross-border-parental-abduction-and-pa-intersection",
    "evidence:childrens-rights-paramountcy-doctrine"
  ],
  "sources": [
    {
      "title": "Eastern Caribbean Supreme Court",
      "url": "https://www.eccourts.org/",
      "publisher": "ECSC",
      "language": "en"
    },
    {
      "title": "Judicial Committee of the Privy Council",
      "url": "https://www.jcpc.uk/",
      "publisher": "JCPC",
      "language": "en"
    }
  ],
  "editorial_notes": [
    "Anguilla jurisdiction sidecar v1.1 — deepened 2026-06-09 from 2 to 10 key_developments with full Anguillan-revolution-to-contemporary trajectory: 1967-Anguillan-revolution-+-secession-from-St-Kitts + 1980-Anguilla-formal-separation-+-BOT-consolidation + 1982-Anguilla-Constitution-Order + 1986-Hague-Convention-1980-territorial-extension + 1991-1994-UNCRC-+-BOT-extension + 2001-British-Overseas-Territories-Act-+-British-citizenship + 2010-Anguilla-Banking-Crisis-+-reconstruction + 2014-Children-Act + 2017-Hurricane-Irma-+-reconstruction-+-Brexit-context + 2024-ECSC-+-JCPC-welfare-of-the-child.",
    "Common-law Caribbean BOT (Children Act 2014 + ECSC OECS-shared + JCPC + Hague via UK territorial extension 1986).",
    "PA-recognition: silent statutory + no-apex-position + silent regulator — substantive welfare-of-the-child analysis under Children Act 2014 s. 3 framework without doctrinal 'parental alienation' label.",
    "Joins Caribbean + common-law + BOT-cluster + only-post-independence-secession-reversal-to-BOT-status-globally + OECS-shared-judicial-system + JCPC-final-appellate + Hague-via-UK-territorial-extension-1986 + Hurricane-Irma-2017-climate-disaster-distinctive + Anguilla-Banking-Crisis-2010 clusters within the corpus."
  ]
}
