{
  "schema_version": "1.0",
  "id": "pratas-islands",
  "name": "Pratas Islands (Dongsha Islands / 東沙群島)",
  "jurisdiction_code": "XX-PRA",
  "legal_system": "civil-law",
  "language": ["zh"],
  "license": "CC-BY-4.0",
  "generated": "2026-06-05",
  "summary": "The Pratas Islands (Dongsha Islands / 東沙群島 Dōngshā Qúndǎo) are a northern South China Sea archipelago comprising one main coral island (Pratas Island / Dongsha Island ~1.7 km²) and two associated atolls (North Vereker Bank and South Vereker Bank), located ~340 km southwest of Kaohsiung, Taiwan and ~260 km southeast of mainland China's Guangdong Province coast — structurally distinctive globally as the only South China Sea feature controlled by Taiwan/Republic of China continuously since 1946 without subsequent loss to mainland PRC, and as the northernmost feature of the disputed South China Sea claimed territory. The Pratas Islands are administered by Taiwan as part of Cijin District, Kaohsiung City (since 2007), and house Taiwan Coast Guard Administration personnel and a small civilian-research staff at the Dongsha Atoll Research Station and Dongsha Marine National Park (Taiwan's first marine national park, established 17 January 2007). Pratas Island hosts a 1,550-metre runway capable of supporting Taiwan Air Force C-130 transport operations. The Pratas Islands are claimed by the People's Republic of China as part of the broader South China Sea claim but have never been under PRC physical control (unlike the Paracels which PRC seized from South Vietnam in 1974). Family-law framework operates under the Civil Code of the Republic of China (中華民國民法 1929) applied via Kaohsiung City administrative framework. Parental authority and child custody operate under Civil Code Book IV — Family Articles 1084-1090 (親權 / chinquan / parental authority) as amended by the 2007 Family Law reforms removing patriarchal presumption in favour of best-interests-of-child standard. The Taiwan Supreme Court is the apex domestic court for civil and criminal matters from Pratas Islands via Taiwan administration. The Pratas Islands are silent on 'parental alienation' as a statutory label. Taiwan is not a UN member and not a party to the Hague Convention 1980 — Pratas Islands non-Hague status applies.",
  "pa_recognition_status": {
    "statutory": "silent",
    "apex_court_position": "no-apex-position",
    "professional_regulator_position": "silent"
  },
  "statutory_framework": [
    {
      "citation": "Civil Code of the Republic of China 1929 (Book IV — Family, applicable in Pratas Islands)",
      "title": "Civil Code of the Republic of China Book IV",
      "year": 1929,
      "url": "https://law.moj.gov.tw/",
      "relevance": "ROC Civil Code Book IV — Family Articles 1084-1090 governing 親權 (chinquan / parental authority) applicable in Pratas Islands via Kaohsiung City administrative framework."
    },
    {
      "citation": "Dongsha Marine National Park Establishment 2007",
      "title": "Dongsha Marine National Park",
      "year": 2007,
      "url": "https://www.marine.gov.tw/",
      "relevance": "Taiwan Executive Yuan establishment of Dongsha Marine National Park on 17 January 2007 — Taiwan's first marine national park, including Pratas Islands."
    },
    {
      "citation": "Kaohsiung City Administrative Framework",
      "title": "Kaohsiung City Administrative Framework",
      "year": 2007,
      "url": "https://www.kcg.gov.tw/",
      "relevance": "Taiwan Executive Yuan establishment of Cijin District, Kaohsiung City as administrative framework for Pratas Islands since 2007."
    }
  ],
  "apex_courts": [
    {
      "name": "Supreme Court of the Republic of China (Taiwan)",
      "seat": "Taipei",
      "url": "https://tps.judicial.gov.tw/",
      "role": "Apex court for civil and criminal matters from Pratas Islands via Taiwan administration."
    }
  ],
  "professional_regulators": [
    {
      "name": "Taiwan Counseling Psychology Association",
      "url": "https://www.twcpa.org.tw/",
      "role": "Taiwan professional regulatory framework applicable in Pratas Islands via Taiwan administration."
    }
  ],
  "anonymisation_convention": "Pratas Islands decisions are anonymised per Taiwan court practice using initials.",
  "key_developments": [
    {
      "year": 1946,
      "title": "ROC reassertion of Pratas Islands control",
      "description": "Republic of China reasserted control of Pratas Islands in 1946 following defeat of Japan in WWII — continuous Taiwan control since 1946."
    },
    {
      "year": 1947,
      "title": "ROC nine-dash line publication including Pratas Islands",
      "description": "Republic of China Ministry of the Interior published map with eleven-dash-line (subsequently reduced to nine-dash-line by PRC) including Pratas Islands."
    },
    {
      "year": 2007,
      "title": "Dongsha Marine National Park + Kaohsiung City administrative integration",
      "description": "Taiwan Executive Yuan established Dongsha Marine National Park on 17 January 2007 — Taiwan's first marine national park — and integrated Pratas Islands into Cijin District, Kaohsiung City."
    },
    {
      "year": 2024,
      "title": "Continuing Taiwan Coast Guard presence",
      "description": "Taiwan Coast Guard Administration continues permanent presence on Pratas Island with regular rotations and 1,550-metre runway supporting Taiwan Air Force C-130 transport operations."
    }
  ],
  "structural_findings": [
    "Pratas Islands operate a civil-law ROC Civil Code framework via Taiwan administration since 1946 — places Pratas Islands in the South China Sea Taiwan-administered-disputed-territory cluster.",
    "Only South China Sea feature controlled by Taiwan/Republic of China continuously since 1946 without subsequent loss to mainland PRC is structurally distinctive globally — distinct from Itu Aba (Spratlys, also Taiwan-controlled but as part of multi-state-claim) and Paracels (lost to PRC 1974).",
    "Northernmost feature of disputed South China Sea claimed territory is structurally distinctive globally.",
    "Taiwan's first marine national park (Dongsha Marine National Park) is structurally distinctive globally — marine-conservation-framework-overlay on disputed territory.",
    "PRC claim without physical control is structurally distinctive within South China Sea disputed-feature cluster — unlike Paracels (PRC physical control via 1974 Battle) or Spratly artificial-island construction.",
    "1,550-metre runway supporting Taiwan Air Force C-130 transport operations is structurally distinctive globally — only South China Sea civilian-research disputed-feature with fixed-wing transport capability.",
    "Taiwan non-UN-member non-Hague-Convention-1980 status applies."
  ],
  "references": [
    "jurisdiction:taiwan",
    "jurisdiction:china",
    "jurisdiction:spratly-islands",
    "jurisdiction:paracel-islands",
    "evidence:cross-border-parental-abduction-and-pa-intersection",
    "evidence:childrens-rights-paramountcy-doctrine"
  ],
  "sources": [
    {
      "title": "Marine National Park Headquarters (Taiwan)",
      "url": "https://www.marine.gov.tw/",
      "publisher": "Taiwan Government",
      "language": "zh"
    },
    {
      "title": "Kaohsiung City Government",
      "url": "https://www.kcg.gov.tw/",
      "publisher": "Taiwan Government",
      "language": "zh"
    },
    {
      "title": "Supreme Court of the Republic of China",
      "url": "https://tps.judicial.gov.tw/",
      "publisher": "Taiwan Government",
      "language": "zh"
    }
  ],
  "editorial_notes": [
    "Pratas Islands jurisdiction sidecar — civil-law Taiwan-administered northern South China Sea disputed archipelago (ROC Civil Code Book IV Articles 1084-1090 + Dongsha Marine National Park 2007 + Cijin District Kaohsiung City administrative framework + PRC claim without physical control + 1,550m runway + Taiwan Coast Guard Administration presence + Taiwan non-Hague-1980). Only South China Sea feature controlled by Taiwan/ROC continuously since 1946 without subsequent loss to mainland PRC globally + northernmost feature of disputed South China Sea claimed territory + Taiwan's first marine national park + only South China Sea disputed-feature with fixed-wing transport capability.",
    "PA-recognition: silent statutory + no-apex-position + silent regulator.",
    "Joins South China Sea + civil-law + Taiwan-administered-disputed-territory cluster + continuous-Taiwan-control-since-1946-globally-distinctive + northernmost-South-China-Sea-disputed-feature + Dongsha-Marine-National-Park-first-Taiwan-marine-national-park + PRC-claim-without-physical-control + 1,550m-runway-fixed-wing-transport + Taiwan-non-Hague-1980 clusters within the corpus."
  ]
}
